{
  "lastSyncAt": "2026-03-06T09:00:01.301407",
  "lastSyncStatus": "success",
  "syncHistory": [
    {
      "timestamp": "2026-03-06T09:00:01.301407",
      "ticketsFetched": 0,
      "added": 0,
      "updated": 0,
      "closed": 0,
      "changes": [],
      "errors": [],
      "status": "success"
    },
    {
      "timestamp": "2026-03-06T08:30:01.905321",
      "ticketsFetched": 0,
      "added": 0,
      "updated": 0,
      "closed": 0,
      "changes": [],
      "errors": [],
      "status": "success"
    },
    {
      "timestamp": "2026-03-06T08:00:01.775355",
      "ticketsFetched": 0,
      "added": 0,
      "updated": 0,
      "closed": 14,
      "changes": [
        {
          "type": "completed",
          "ticket": "VV-1195",
          "summary": "DRX Channel Config Missing Store Slug"
        },
        {
          "type": "completed",
          "ticket": "VV-1202",
          "summary": "Not able to Add User Profile"
        },
        {
          "type": "completed",
          "ticket": "VV-1203",
          "summary": "Address Line 1 and 2 is Not Saved When Creating a Clinic"
        },
        {
          "type": "completed",
          "ticket": "VV-1204",
          "summary": "ScriptSure Setting Reverts to Enabled After Saving"
        },
        {
          "type": "completed",
          "ticket": "VV-1210",
          "summary": "Licensed Number Not Saved When Creating New User"
        },
        {
          "type": "completed",
          "ticket": "VV-1212",
          "summary": "Assigned Clinic Not Displayed"
        },
        {
          "type": "completed",
          "ticket": "VV-1240",
          "summary": "Exported Files from Administration Module Display JSON Data Instead of Structured Columns"
        },
        {
          "type": "completed",
          "ticket": "RD-4",
          "summary": "Validating Data Population in Prescription Form \u2013 Medication Details Section"
        },
        {
          "type": "completed",
          "ticket": "RD-29",
          "summary": "Unable to Update Channel Settings for ScriptSure"
        },
        {
          "type": "completed",
          "ticket": "RD-30",
          "summary": "LifeFile Not Yet Available in Staging"
        },
        {
          "type": "completed",
          "ticket": "RD-31",
          "summary": "Add Rx Compounding API Integrations"
        },
        {
          "type": "completed",
          "ticket": "RD-25",
          "summary": "Add Multiple Medications in a Single Prescription Order"
        },
        {
          "type": "completed",
          "ticket": "RD-33",
          "summary": "Create webhook for tracking"
        },
        {
          "type": "completed",
          "ticket": "RD-32",
          "summary": "Add Partell Sending Order API Integrations"
        }
      ],
      "errors": [],
      "status": "success"
    },
    {
      "timestamp": "2026-03-04T15:30:01.401681",
      "ticketsFetched": 14,
      "added": 0,
      "updated": 0,
      "closed": 0,
      "changes": [],
      "errors": [],
      "status": "success"
    },
    {
      "timestamp": "2026-03-04T15:00:01.567438",
      "ticketsFetched": 14,
      "added": 0,
      "updated": 0,
      "closed": 0,
      "changes": [],
      "errors": [],
      "status": "success"
    },
    {
      "timestamp": "2026-03-04T14:30:01.603892",
      "ticketsFetched": 14,
      "added": 0,
      "updated": 2,
      "closed": 0,
      "changes": [
        {
          "type": "status_change",
          "ticket": "RD-30",
          "from": "Backlog",
          "to": "Testing"
        },
        {
          "type": "status_change",
          "ticket": "RD-29",
          "from": "Backlog",
          "to": "Testing"
        }
      ],
      "errors": [],
      "status": "success"
    },
    {
      "timestamp": "2026-03-04T14:00:01.808655",
      "ticketsFetched": 14,
      "added": 0,
      "updated": 0,
      "closed": 0,
      "changes": [],
      "errors": [],
      "status": "success"
    },
    {
      "timestamp": "2026-03-04T13:30:01.413251",
      "ticketsFetched": 14,
      "added": 0,
      "updated": 1,
      "closed": 0,
      "changes": [
        {
          "type": "status_change",
          "ticket": "RD-4",
          "from": "In Progress",
          "to": "Testing"
        }
      ],
      "errors": [],
      "status": "success"
    },
    {
      "timestamp": "2026-03-04T13:00:01.105860",
      "ticketsFetched": 14,
      "added": 0,
      "updated": 0,
      "closed": 0,
      "changes": [],
      "errors": [],
      "status": "success"
    },
    {
      "timestamp": "2026-03-04T12:30:01.117717",
      "ticketsFetched": 14,
      "added": 0,
      "updated": 0,
      "closed": 0,
      "changes": [],
      "errors": [],
      "status": "success"
    },
    {
      "timestamp": "2026-03-04T12:00:01.772241",
      "ticketsFetched": 14,
      "added": 0,
      "updated": 0,
      "closed": 0,
      "changes": [],
      "errors": [],
      "status": "success"
    },
    {
      "timestamp": "2026-03-04T11:30:01.232983",
      "ticketsFetched": 14,
      "added": 0,
      "updated": 0,
      "closed": 0,
      "changes": [],
      "errors": [],
      "status": "success"
    },
    {
      "timestamp": "2026-03-04T11:00:02.073253",
      "ticketsFetched": 14,
      "added": 0,
      "updated": 0,
      "closed": 0,
      "changes": [],
      "errors": [],
      "status": "success"
    },
    {
      "timestamp": "2026-03-04T10:30:01.791059",
      "ticketsFetched": 14,
      "added": 0,
      "updated": 0,
      "closed": 0,
      "changes": [],
      "errors": [],
      "status": "success"
    },
    {
      "timestamp": "2026-03-04T10:00:01.479443",
      "ticketsFetched": 14,
      "added": 0,
      "updated": 0,
      "closed": 0,
      "changes": [],
      "errors": [],
      "status": "success"
    },
    {
      "timestamp": "2026-03-04T09:30:02.068135",
      "ticketsFetched": 14,
      "added": 0,
      "updated": 0,
      "closed": 0,
      "changes": [],
      "errors": [],
      "status": "success"
    },
    {
      "timestamp": "2026-03-04T09:00:01.178796",
      "ticketsFetched": 14,
      "added": 0,
      "updated": 0,
      "closed": 0,
      "changes": [],
      "errors": [],
      "status": "success"
    },
    {
      "timestamp": "2026-03-04T08:30:01.572695",
      "ticketsFetched": 14,
      "added": 0,
      "updated": 0,
      "closed": 0,
      "changes": [],
      "errors": [],
      "status": "success"
    },
    {
      "timestamp": "2026-03-04T08:00:01.380072",
      "ticketsFetched": 14,
      "added": 0,
      "updated": 0,
      "closed": 0,
      "changes": [],
      "errors": [],
      "status": "success"
    },
    {
      "timestamp": "2026-03-04T07:30:01.699536",
      "ticketsFetched": 14,
      "added": 0,
      "updated": 0,
      "closed": 0,
      "changes": [],
      "errors": [],
      "status": "success"
    },
    {
      "timestamp": "2026-03-04T07:00:01.329928",
      "ticketsFetched": 14,
      "added": 0,
      "updated": 0,
      "closed": 0,
      "changes": [],
      "errors": [],
      "status": "success"
    },
    {
      "timestamp": "2026-03-04T06:30:01.385304",
      "ticketsFetched": 14,
      "added": 0,
      "updated": 0,
      "closed": 0,
      "changes": [],
      "errors": [],
      "status": "success"
    },
    {
      "timestamp": "2026-03-04T06:00:01.697672",
      "ticketsFetched": 14,
      "added": 0,
      "updated": 0,
      "closed": 0,
      "changes": [],
      "errors": [],
      "status": "success"
    },
    {
      "timestamp": "2026-03-03T22:30:01.113081",
      "ticketsFetched": 14,
      "added": 0,
      "updated": 0,
      "closed": 0,
      "changes": [],
      "errors": [],
      "status": "success"
    },
    {
      "timestamp": "2026-03-03T22:00:01.164523",
      "ticketsFetched": 14,
      "added": 0,
      "updated": 0,
      "closed": 0,
      "changes": [],
      "errors": [],
      "status": "success"
    },
    {
      "timestamp": "2026-03-03T21:30:01.464079",
      "ticketsFetched": 14,
      "added": 0,
      "updated": 0,
      "closed": 0,
      "changes": [],
      "errors": [],
      "status": "success"
    },
    {
      "timestamp": "2026-03-03T21:00:01.306621",
      "ticketsFetched": 14,
      "added": 0,
      "updated": 0,
      "closed": 0,
      "changes": [],
      "errors": [],
      "status": "success"
    },
    {
      "timestamp": "2026-03-03T20:30:01.600649",
      "ticketsFetched": 14,
      "added": 0,
      "updated": 0,
      "closed": 0,
      "changes": [],
      "errors": [],
      "status": "success"
    },
    {
      "timestamp": "2026-03-03T20:00:01.889285",
      "ticketsFetched": 14,
      "added": 0,
      "updated": 0,
      "closed": 0,
      "changes": [],
      "errors": [],
      "status": "success"
    },
    {
      "timestamp": "2026-03-03T19:30:01.169839",
      "ticketsFetched": 14,
      "added": 0,
      "updated": 0,
      "closed": 0,
      "changes": [],
      "errors": [],
      "status": "success"
    },
    {
      "timestamp": "2026-03-03T19:00:01.576060",
      "ticketsFetched": 14,
      "added": 0,
      "updated": 0,
      "closed": 0,
      "changes": [],
      "errors": [],
      "status": "success"
    },
    {
      "timestamp": "2026-03-03T18:30:01.752717",
      "ticketsFetched": 14,
      "added": 0,
      "updated": 0,
      "closed": 0,
      "changes": [],
      "errors": [],
      "status": "success"
    },
    {
      "timestamp": "2026-03-03T18:00:01.385111",
      "ticketsFetched": 14,
      "added": 0,
      "updated": 0,
      "closed": 0,
      "changes": [],
      "errors": [],
      "status": "success"
    },
    {
      "timestamp": "2026-03-03T17:30:01.772816",
      "ticketsFetched": 14,
      "added": 2,
      "updated": 0,
      "closed": 0,
      "changes": [
        {
          "type": "new",
          "ticket": "RD-33",